{
  "$schema": "https://raccourci.malvu.fr/schemas/aethryon-theme.v1.json",
  "format": "aethryon-theme",
  "schemaVersion": 1,
  "id": "officiel.minimal",
  "name": "Minimal",
  "author": "AETHRYON",
  "base": "minimal",
  "typography": {
    "preset": "sobre",
    "scale": 1
  },
  "density": "compacte",
  "motion": {
    "intensity": "reduite"
  },
  "effects": {
    "sheen": false,
    "grain": false
  }
}
